"","video_id","publishedAt","channelId","title","description","thumbnails.default.url","thumbnails.default.width","thumbnails.default.height","thumbnails.medium.url","thumbnails.medium.width","thumbnails.medium.height","thumbnails.high.url","thumbnails.high.width","thumbnails.high.height","channelTitle","liveBroadcastContent","publishTime"
"417","TsjVbJH6KXI","2023-10-24T15:18:44Z","UCeY0bbntWzzVIaj2z3QigXg","Morning News NOW Full Broadcast - Oct. 24","One of two hostages released by Hamas describes her time in captivity, nearly 7000 United Auto Worker members walk off the job ...","https://i.ytimg.com/vi/TsjVbJH6KXI/default.jpg","120","90","https://i.ytimg.com/vi/TsjVbJH6KXI/mqdefault.jpg","320","180","https://i.ytimg.com/vi/TsjVbJH6KXI/hqdefault.jpg","480","360","NBC News","none","2023-10-24T15:18:44Z"
"418","UK4tPEoWdag","2022-03-11T03:03:19Z","UCeY0bbntWzzVIaj2z3QigXg","Top Story with Tom Llamas - March 10 | NBC News NOW","There are growing calls for war crimes charges against Russia following a deadly hospital attack that killed at least three people ...","https://i.ytimg.com/vi/UK4tPEoWdag/default.jpg","120","90","https://i.ytimg.com/vi/UK4tPEoWdag/mqdefault.jpg","320","180","https://i.ytimg.com/vi/UK4tPEoWdag/hqdefault.jpg","480","360","NBC News","none","2022-03-11T03:03:19Z"
"419","WH6PCFSYdB4","2021-11-23T16:46:46Z","UCeY0bbntWzzVIaj2z3QigXg","Morning News NOW Full Broadcast - Nov. 23","Attorneys deliver closing arguments in the Ahmaud Arbery murder trial, a doorbell video appears to show the Waukesha parade ...","https://i.ytimg.com/vi/WH6PCFSYdB4/default.jpg","120","90","https://i.ytimg.com/vi/WH6PCFSYdB4/mqdefault.jpg","320","180","https://i.ytimg.com/vi/WH6PCFSYdB4/hqdefault.jpg","480","360","NBC News","none","2021-11-23T16:46:46Z"
"420","mq4rm9kQSOE","2021-07-20T15:22:30Z","UCeY0bbntWzzVIaj2z3QigXg","Morning News NOW Full Broadcast - July 20","A pediatricians group issues new mask guidance for schools, Covid cases climb in Tokyo ahead of the Olympics, and Prince ...","https://i.ytimg.com/vi/mq4rm9kQSOE/default.jpg","120","90","https://i.ytimg.com/vi/mq4rm9kQSOE/mqdefault.jpg","320","180","https://i.ytimg.com/vi/mq4rm9kQSOE/hqdefault.jpg","480","360","NBC News","none","2021-07-20T15:22:30Z"
"421","niUr5Fof2OY","2023-10-22T23:02:28Z","UCeY0bbntWzzVIaj2z3QigXg","‘Destroying Hamas is non-negotiable’: U.S. senators pledge support for Israel","A bipartisan group of U.S. senators pledged support for Israel during a press conference in Tel Aviv and accused Iran of being ...","https://i.ytimg.com/vi/niUr5Fof2OY/default.jpg","120","90","https://i.ytimg.com/vi/niUr5Fof2OY/mqdefault.jpg","320","180","https://i.ytimg.com/vi/niUr5Fof2OY/hqdefault.jpg","480","360","NBC News","none","2023-10-22T23:02:28Z"
"422","WgC1H8_0bLI","2022-06-26T18:30:38Z","UCeY0bbntWzzVIaj2z3QigXg","Meet The Press Broadcast (Full) - June 26","Rep. Ocasio- Cortez (D-N.Y.) joins Meet the Press for an exclusive interview to discuss the Democratic Party's role in the ...","https://i.ytimg.com/vi/WgC1H8_0bLI/default.jpg","120","90","https://i.ytimg.com/vi/WgC1H8_0bLI/mqdefault.jpg","320","180","https://i.ytimg.com/vi/WgC1H8_0bLI/hqdefault.jpg","480","360","NBC News","none","2022-06-26T18:30:38Z"
"423","G9sw6ZJ7azY","2021-12-08T16:47:10Z","UCeY0bbntWzzVIaj2z3QigXg","Morning News NOW Full Broadcast - Dec. 8","Pfizer releases new data on its Covid vaccine efficacy against the omicron variant, President Biden warns Russian President Putin ...","https://i.ytimg.com/vi/G9sw6ZJ7azY/default.jpg","120","90","https://i.ytimg.com/vi/G9sw6ZJ7azY/mqdefault.jpg","320","180","https://i.ytimg.com/vi/G9sw6ZJ7azY/hqdefault.jpg","480","360","NBC News","none","2021-12-08T16:47:10Z"
"424","b6EwalZRJCw","2022-04-24T18:30:35Z","UCeY0bbntWzzVIaj2z3QigXg","Meet The Press Broadcast (Full) - April 24","Kristen Welker guest hosts Meet the Press to discuss the continuing war in Ukraine and fractures in both parties ahead of the ...","https://i.ytimg.com/vi/b6EwalZRJCw/default.jpg","120","90","https://i.ytimg.com/vi/b6EwalZRJCw/mqdefault.jpg","320","180","https://i.ytimg.com/vi/b6EwalZRJCw/hqdefault.jpg","480","360","NBC News","none","2022-04-24T18:30:35Z"
"425","zZa2GdXr5j0","2023-10-23T18:20:14Z","UCeY0bbntWzzVIaj2z3QigXg","LIVE: White House holds press briefing | NBC News","Watch as White House Press Secretary Karine Jean-Pierre holds a press briefing. » Subscribe to NBC News: ...","https://i.ytimg.com/vi/zZa2GdXr5j0/default.jpg","120","90","https://i.ytimg.com/vi/zZa2GdXr5j0/mqdefault.jpg","320","180","https://i.ytimg.com/vi/zZa2GdXr5j0/hqdefault.jpg","480","360","NBC News","none","2023-10-23T18:20:14Z"
"426","7c5q4cdSOY0","2022-04-04T15:27:30Z","UCeY0bbntWzzVIaj2z3QigXg","Morning News NOW Full Broadcast - April 4","Ukrainian troops discover hundreds of bodies in the town of Bucha as Russian forces withdraw from the region, at least six people ...","https://i.ytimg.com/vi/7c5q4cdSOY0/default.jpg","120","90","https://i.ytimg.com/vi/7c5q4cdSOY0/mqdefault.jpg","320","180","https://i.ytimg.com/vi/7c5q4cdSOY0/hqdefault.jpg","480","360","NBC News","none","2022-04-04T15:27:30Z"
"427","kVhJzogMdO4","2023-10-22T17:30:04Z","UCeY0bbntWzzVIaj2z3QigXg","Full Blinken: ‘Israel can not go back to the status quo’ after war with Hamas","Secretary of State Antony Blinken discusses Israel's conflict with Hamas and the looming threat of a two-front war during an ...","https://i.ytimg.com/vi/kVhJzogMdO4/default.jpg","120","90","https://i.ytimg.com/vi/kVhJzogMdO4/mqdefault.jpg","320","180","https://i.ytimg.com/vi/kVhJzogMdO4/hqdefault.jpg","480","360","NBC News","none","2023-10-22T17:30:04Z"
"428","uqAxhETywCo","2021-07-05T12:08:00Z","UCeY0bbntWzzVIaj2z3QigXg","This Morning’s Top Headlines – July 5 | Morning News NOW","The remaining part of the collapsed Surfside, Florida, condo is demolished, tropical storm Elsa batters Cuba with heavy rain and ...","https://i.ytimg.com/vi/uqAxhETywCo/default.jpg","120","90","https://i.ytimg.com/vi/uqAxhETywCo/mqdefault.jpg","320","180","https://i.ytimg.com/vi/uqAxhETywCo/hqdefault.jpg","480","360","NBC News","none","2021-07-05T12:08:00Z"
"429","X1hqNZ7XW2E","2023-10-22T19:15:00Z","UCeY0bbntWzzVIaj2z3QigXg","U.S. expects ‘likelihood of escalation’ in the Middle East, Blinken says","Secretary of State Antony Blinken says the U.S. has sent a “very strong message” to deter Hezbollah and Iran from escalating ...","https://i.ytimg.com/vi/X1hqNZ7XW2E/default.jpg","120","90","https://i.ytimg.com/vi/X1hqNZ7XW2E/mqdefault.jpg","320","180","https://i.ytimg.com/vi/X1hqNZ7XW2E/hqdefault.jpg","480","360","NBC News","none","2023-10-22T19:15:00Z"
"430","HplcdnGjcEw","2023-10-23T18:00:09Z","UCeY0bbntWzzVIaj2z3QigXg","The challenges Israeli troops could encounter in Hamas’ tunnels","An extensive underground network of tunnels built by Hamas presents a unique challenge for Israel if it decides to carry out its ...","https://i.ytimg.com/vi/HplcdnGjcEw/default.jpg","120","90","https://i.ytimg.com/vi/HplcdnGjcEw/mqdefault.jpg","320","180","https://i.ytimg.com/vi/HplcdnGjcEw/hqdefault.jpg","480","360","NBC News","none","2023-10-23T18:00:09Z"
"431","vVypNYZToNQ","2022-07-26T23:28:26Z","UCeY0bbntWzzVIaj2z3QigXg","Panel: Trump Seems &#39;Hazy&#39; In D.C. Speech; Democrats Propping Up &#39;Crazy&#39; Candidates","The proxy war between Trump and Pence is heating up in the midterms. But former Republican congressman and MSNBC ...","https://i.ytimg.com/vi/vVypNYZToNQ/default.jpg","120","90","https://i.ytimg.com/vi/vVypNYZToNQ/mqdefault.jpg","320","180","https://i.ytimg.com/vi/vVypNYZToNQ/hqdefault.jpg","480","360","NBC News","none","2022-07-26T23:28:26Z"
"432","UFtvEDL3V9I","2023-10-23T13:30:12Z","UCeY0bbntWzzVIaj2z3QigXg","WATCH: Ships collide near contentious atoll in the South China Sea","China and the Philippines traded accusations over a collision in disputed waters of the South China Sea as Chinese vessels ...","https://i.ytimg.com/vi/UFtvEDL3V9I/default.jpg","120","90","https://i.ytimg.com/vi/UFtvEDL3V9I/mqdefault.jpg","320","180","https://i.ytimg.com/vi/UFtvEDL3V9I/hqdefault.jpg","480","360","NBC News","none","2023-10-23T13:30:12Z"
"433","5LWJ1hVF980","2021-08-24T16:34:48Z","UCeY0bbntWzzVIaj2z3QigXg","Morning News NOW Full Broadcast - August 24","More vaccine mandates are implemented across the country after Pfizer gets full FDA approval, evacuations from Afghanistan ...","https://i.ytimg.com/vi/5LWJ1hVF980/default.jpg","120","90","https://i.ytimg.com/vi/5LWJ1hVF980/mqdefault.jpg","320","180","https://i.ytimg.com/vi/5LWJ1hVF980/hqdefault.jpg","480","360","NBC News","none","2021-08-24T16:34:48Z"
"434","TxMx25OnJ0s","2022-01-24T01:11:25Z","UCeY0bbntWzzVIaj2z3QigXg","Anti-Vaccine Mandate Protests During Omicron Surge","Thousands gathered in D.C. Sunday for the “Defeat the Mandate” protest as the Northeast and Mid-Atlantic see significant drops ...","https://i.ytimg.com/vi/TxMx25OnJ0s/default.jpg","120","90","https://i.ytimg.com/vi/TxMx25OnJ0s/mqdefault.jpg","320","180","https://i.ytimg.com/vi/TxMx25OnJ0s/hqdefault.jpg","480","360","NBC News","none","2022-01-24T01:11:25Z"
"435","Oap20XgEmF0","2023-10-24T00:30:11Z","UCeY0bbntWzzVIaj2z3QigXg","Detroit synagogue president stabbed to death, no arrests announced yet","An investigation is underway after a well-known Detroit Jewish leader was stabbed to death. Multiple persons of interest are being ...","https://i.ytimg.com/vi/Oap20XgEmF0/default.jpg","120","90","https://i.ytimg.com/vi/Oap20XgEmF0/mqdefault.jpg","320","180","https://i.ytimg.com/vi/Oap20XgEmF0/hqdefault.jpg","480","360","NBC News","none","2023-10-24T00:30:11Z"
"436","Q7GKSQ-yMdw","2023-10-22T16:30:05Z","UCeY0bbntWzzVIaj2z3QigXg","Full McCarthy: I don’t need the speakership ‘title. I’m going to help in any way I can’","Former House Speaker Kevin McCarthy (R-Calif.) joins Meet the Press in an exclusive interview to discuss House Republicans' ...","https://i.ytimg.com/vi/Q7GKSQ-yMdw/default.jpg","120","90","https://i.ytimg.com/vi/Q7GKSQ-yMdw/mqdefault.jpg","320","180","https://i.ytimg.com/vi/Q7GKSQ-yMdw/hqdefault.jpg","480","360","NBC News","none","2023-10-22T16:30:05Z"
"437","WQdE8K3lf-g","2022-01-30T19:30:01Z","UCeY0bbntWzzVIaj2z3QigXg","Meet The Press Broadcast (Full) - Jan. 30","Sen. Dick Durbin (D-Ill.), chair of the Senate Judiciary Committee, talks about the retirement of Supreme Court Justice Stephen ...","https://i.ytimg.com/vi/WQdE8K3lf-g/default.jpg","120","90","https://i.ytimg.com/vi/WQdE8K3lf-g/mqdefault.jpg","320","180","https://i.ytimg.com/vi/WQdE8K3lf-g/hqdefault.jpg","480","360","NBC News","none","2022-01-30T19:30:01Z"
"438","_kG-9zo1rhs","2023-10-22T18:00:16Z","UCeY0bbntWzzVIaj2z3QigXg","Blinken: Israel has &#39;no intent&#39; to govern Gaza after war with Hamas","Blinken: #Israel has 'no intent' to govern #Gaza after war with Hamas » Subscribe to NBC News: ...","https://i.ytimg.com/vi/_kG-9zo1rhs/default.jpg","120","90","https://i.ytimg.com/vi/_kG-9zo1rhs/mqdefault.jpg","320","180","https://i.ytimg.com/vi/_kG-9zo1rhs/hqdefault.jpg","480","360","NBC News","none","2023-10-22T18:00:16Z"
"439","VgjNOEydXJg","2022-03-20T16:46:24Z","UCeY0bbntWzzVIaj2z3QigXg","Full Panel: Biden, Xi Offer Conflicting Accounts Of Call Over Ukraine","Andrea Mitchell, Amna Nawaz, David Ignatius and Shane Harris join the Meet the Press roundtable to discuss conflicting accounts ...","https://i.ytimg.com/vi/VgjNOEydXJg/default.jpg","120","90","https://i.ytimg.com/vi/VgjNOEydXJg/mqdefault.jpg","320","180","https://i.ytimg.com/vi/VgjNOEydXJg/hqdefault.jpg","480","360","NBC News","none","2022-03-20T16:46:24Z"
"440","Mgaw6sJLSqQ","2022-01-09T00:14:43Z","UCeY0bbntWzzVIaj2z3QigXg","Severe Weather Cripples The U.S. From Coast To Coast","The Pacific Northwest is experiencing record rain and snowmelt. On the other side of the country, 57 million Americans are under ...","https://i.ytimg.com/vi/Mgaw6sJLSqQ/default.jpg","120","90","https://i.ytimg.com/vi/Mgaw6sJLSqQ/mqdefault.jpg","320","180","https://i.ytimg.com/vi/Mgaw6sJLSqQ/hqdefault.jpg","480","360","NBC News","none","2022-01-09T00:14:43Z"
"441","LtVic4k2uzI","2022-03-02T07:58:37Z","UCeY0bbntWzzVIaj2z3QigXg","2022 State Of The Union | NBC News","Watch as President Biden delivers his first State of the Union address live at the United States Capitol. Follow the NBC news live ...","https://i.ytimg.com/vi/LtVic4k2uzI/default.jpg","120","90","https://i.ytimg.com/vi/LtVic4k2uzI/mqdefault.jpg","320","180","https://i.ytimg.com/vi/LtVic4k2uzI/hqdefault.jpg","480","360","NBC News","none","2022-03-02T07:58:37Z"
"442","qxrns5ZVs4k","2022-05-20T00:11:52Z","UCeY0bbntWzzVIaj2z3QigXg","Hallie Jackson NOW - May 19 | NBC News NOW","Concerns grow for “stagflation” as stocks continue to drop, a New York judge weighs in on whether a 51-year-old elephant can ...","https://i.ytimg.com/vi/qxrns5ZVs4k/default.jpg","120","90","https://i.ytimg.com/vi/qxrns5ZVs4k/mqdefault.jpg","320","180","https://i.ytimg.com/vi/qxrns5ZVs4k/hqdefault.jpg","480","360","NBC News","none","2022-05-20T00:11:52Z"
"443","p9AVYyFd9lo","2022-03-07T00:36:31Z","UCeY0bbntWzzVIaj2z3QigXg","U.S. In Talks To Boost Ukrainian Defenses And Ban Russian Oil","The U.S. and Poland are working on a plan to send fighter jets to Ukraine to help the country defend its skies as lawmakers step ...","https://i.ytimg.com/vi/p9AVYyFd9lo/default.jpg","120","90","https://i.ytimg.com/vi/p9AVYyFd9lo/mqdefault.jpg","320","180","https://i.ytimg.com/vi/p9AVYyFd9lo/hqdefault.jpg","480","360","NBC News","none","2022-03-07T00:36:31Z"
"444","DAEc8Qh6tdw","2021-06-27T18:00:03Z","UCeY0bbntWzzVIaj2z3QigXg","Meet The Press Broadcast (Full) - June 27th, 2021","Miami-Dade County Mayor Daniella Levine Cava discusses the latest on the Surfside condo collapse. Sen. Bill Cassidy (R-La.)","https://i.ytimg.com/vi/DAEc8Qh6tdw/default.jpg","120","90","https://i.ytimg.com/vi/DAEc8Qh6tdw/mqdefault.jpg","320","180","https://i.ytimg.com/vi/DAEc8Qh6tdw/hqdefault.jpg","480","360","NBC News","none","2021-06-27T18:00:03Z"
"445","RcjBuNy_f0o","2021-02-28T23:45:51Z","UCeY0bbntWzzVIaj2z3QigXg","Meet The Press Broadcast (Full) - February 28th, 2021 | Meet The Press | NBC News","In an exclusive interview, Prime Minister Justin Trudeau talks about U.S.-Canada relations. Sen. Sherrod Brown (D-Ohio) ...","https://i.ytimg.com/vi/RcjBuNy_f0o/default.jpg","120","90","https://i.ytimg.com/vi/RcjBuNy_f0o/mqdefault.jpg","320","180","https://i.ytimg.com/vi/RcjBuNy_f0o/hqdefault.jpg","480","360","NBC News","none","2021-02-28T23:45:51Z"
"446","hE3GCo7jjYs","2021-12-31T02:30:22Z","UCeY0bbntWzzVIaj2z3QigXg","Top Story with Tom Llamas – Dec. 30 | NBC News NOW","The U.S. recorded nearly half a million new Covid-19 cases in a single day but with a lag in testing one doctor says the number of ...","https://i.ytimg.com/vi/hE3GCo7jjYs/default.jpg","120","90","https://i.ytimg.com/vi/hE3GCo7jjYs/mqdefault.jpg","320","180","https://i.ytimg.com/vi/hE3GCo7jjYs/hqdefault.jpg","480","360","NBC News","none","2021-12-31T02:30:22Z"
"447","4_vhGi6lrKQ","2021-11-26T21:00:02Z","UCeY0bbntWzzVIaj2z3QigXg","New Covid Variant Triggers U.S. Travel Restrictions From 8 African Nations","The U.S. is restricting travel from eight African nations because of the threat of a new Covid-19 variant named “Omicron.","https://i.ytimg.com/vi/4_vhGi6lrKQ/default.jpg","120","90","https://i.ytimg.com/vi/4_vhGi6lrKQ/mqdefault.jpg","320","180","https://i.ytimg.com/vi/4_vhGi6lrKQ/hqdefault.jpg","480","360","NBC News","none","2021-11-26T21:00:02Z"
"448","NjdVkVFzYpw","2022-05-31T23:59:19Z","UCeY0bbntWzzVIaj2z3QigXg","Hallie Jackson NOW - May 31 | NBC News NOW","The first funerals began for the children killed in the Uvalde school massacre, the E.U. reaches a deal to ban 90 percent of ...","https://i.ytimg.com/vi/NjdVkVFzYpw/default.jpg","120","90","https://i.ytimg.com/vi/NjdVkVFzYpw/mqdefault.jpg","320","180","https://i.ytimg.com/vi/NjdVkVFzYpw/hqdefault.jpg","480","360","NBC News","none","2022-05-31T23:59:19Z"
"449","2zIRb0rwPK0","2021-07-19T16:24:31Z","UCeY0bbntWzzVIaj2z3QigXg","Morning News NOW Full Broadcast - July 19 | NBC News NOW","Another member of Team USA tests positive for Covid-19, a shooting outside D.C.'s baseball park injures three people, and Jeff ...","https://i.ytimg.com/vi/2zIRb0rwPK0/default.jpg","120","90","https://i.ytimg.com/vi/2zIRb0rwPK0/mqdefault.jpg","320","180","https://i.ytimg.com/vi/2zIRb0rwPK0/hqdefault.jpg","480","360","NBC News","none","2021-07-19T16:24:31Z"
"450","CQC3_reFPLA","2022-02-25T04:00:15Z","UCeY0bbntWzzVIaj2z3QigXg","Top Story with Tom Llamas - Feb. 24 | NBC News NOW","Dozens of Ukrainians have been killed with thousands hiding out in subway stations, Russian forces have seized control of ...","https://i.ytimg.com/vi/CQC3_reFPLA/default.jpg","120","90","https://i.ytimg.com/vi/CQC3_reFPLA/mqdefault.jpg","320","180","https://i.ytimg.com/vi/CQC3_reFPLA/hqdefault.jpg","480","360","NBC News","none","2022-02-25T04:00:15Z"
"451","1ZWvhdjLJq4","2022-04-26T00:00:01Z","UCeY0bbntWzzVIaj2z3QigXg","U.S. Promises More Military Aid In Ukraine As Russia Intensifies Attacks","Russia has unleashed shelling attacks on Kharkiv and continues to intensify its assaults on eastern Ukraine. Secretary of State ...","https://i.ytimg.com/vi/1ZWvhdjLJq4/default.jpg","120","90","https://i.ytimg.com/vi/1ZWvhdjLJq4/mqdefault.jpg","320","180","https://i.ytimg.com/vi/1ZWvhdjLJq4/hqdefault.jpg","480","360","NBC News","none","2022-04-26T00:00:01Z"
"452","HB32ZykpcxY","2022-04-30T02:43:33Z","UCeY0bbntWzzVIaj2z3QigXg","NOW Tonight with Joshua Johnson - April 29 | NBC News NOW","A Marine Corps veteran was killed in Ukraine becoming the first American fatality within war zone, Harvard University president ...","https://i.ytimg.com/vi/HB32ZykpcxY/default.jpg","120","90","https://i.ytimg.com/vi/HB32ZykpcxY/mqdefault.jpg","320","180","https://i.ytimg.com/vi/HB32ZykpcxY/hqdefault.jpg","480","360","NBC News","none","2022-04-30T02:43:33Z"
"453","gXC9Qz0-geo","2022-03-20T23:16:52Z","UCeY0bbntWzzVIaj2z3QigXg","Meet The Press Broadcast (Full) - March 20","NBC News Correspondent Richard Engel reports from the front lines in Ukraine and NATO Secretary General Jens Stoltenberg ...","https://i.ytimg.com/vi/gXC9Qz0-geo/default.jpg","120","90","https://i.ytimg.com/vi/gXC9Qz0-geo/mqdefault.jpg","320","180","https://i.ytimg.com/vi/gXC9Qz0-geo/hqdefault.jpg","480","360","NBC News","none","2022-03-20T23:16:52Z"
"454","D29hFECRLIM","2022-02-20T01:30:02Z","UCeY0bbntWzzVIaj2z3QigXg","Tensions Boil Over In East Ukraine As Attacks Turn Deadly","Ukrainian military leaders were shelled while touring the front lines today. Pro-Russian separatists mobilized their citizens, issuing ...","https://i.ytimg.com/vi/D29hFECRLIM/default.jpg","120","90","https://i.ytimg.com/vi/D29hFECRLIM/mqdefault.jpg","320","180","https://i.ytimg.com/vi/D29hFECRLIM/hqdefault.jpg","480","360","NBC News","none","2022-02-20T01:30:02Z"
"455","u1IYozWc_RY","2021-10-31T01:06:42Z","UCeY0bbntWzzVIaj2z3QigXg","Nightly News Full Broadcast - October 30th","Alec Baldwin speaks out after 'Rust' movie set tragedy, Pfizer begins shipping vaccines for children aged 5-11, and deadline ...","https://i.ytimg.com/vi/u1IYozWc_RY/default.jpg","120","90","https://i.ytimg.com/vi/u1IYozWc_RY/mqdefault.jpg","320","180","https://i.ytimg.com/vi/u1IYozWc_RY/hqdefault.jpg","480","360","NBC News","none","2021-10-31T01:06:42Z"
"456","P2e48T3a98Y","2022-05-26T03:16:51Z","UCeY0bbntWzzVIaj2z3QigXg","Top Story with Tom Llamas - May 25 | NBC News NOW","At least 21 people have been killed in a Texas elementary school massacre, Georgia primary voters rejected candidates backed ...","https://i.ytimg.com/vi/P2e48T3a98Y/default.jpg","120","90","https://i.ytimg.com/vi/P2e48T3a98Y/mqdefault.jpg","320","180","https://i.ytimg.com/vi/P2e48T3a98Y/hqdefault.jpg","480","360","NBC News","none","2022-05-26T03:16:51Z"
"457","ArYrJ3E4jPE","2022-05-04T00:35:42Z","UCeY0bbntWzzVIaj2z3QigXg","Hallie Jackson NOW - May 3 | NBC News NOW","A leaked draft opinion signals a majority of Supreme Court justices are planning to overturn Roe v. Wade. WNBA star Brittney ...","https://i.ytimg.com/vi/ArYrJ3E4jPE/default.jpg","120","90","https://i.ytimg.com/vi/ArYrJ3E4jPE/mqdefault.jpg","320","180","https://i.ytimg.com/vi/ArYrJ3E4jPE/hqdefault.jpg","480","360","NBC News","none","2022-05-04T00:35:42Z"
"458","CO17h89_QuM","2021-08-29T18:30:07Z","UCeY0bbntWzzVIaj2z3QigXg","Meet The Press Broadcast (Full) - August 29th, 2021","Secretary of State Antony Blinken discusses the final days of the U.S. presence in Afghanistan following Thursday's attack. Retired ...","https://i.ytimg.com/vi/CO17h89_QuM/default.jpg","120","90","https://i.ytimg.com/vi/CO17h89_QuM/mqdefault.jpg","320","180","https://i.ytimg.com/vi/CO17h89_QuM/hqdefault.jpg","480","360","NBC News","none","2021-08-29T18:30:07Z"
"459","FfPgKTN04zw","2022-03-09T02:35:44Z","UCeY0bbntWzzVIaj2z3QigXg","Top Story with Tom Llamas - Mar. 8 | NBC News NOW","Ukraine is accusing Russia of firing on a humanitarian corridor being used to evacuate residents from the city of Sumy, Moscow is ...","https://i.ytimg.com/vi/FfPgKTN04zw/default.jpg","120","90","https://i.ytimg.com/vi/FfPgKTN04zw/mqdefault.jpg","320","180","https://i.ytimg.com/vi/FfPgKTN04zw/hqdefault.jpg","480","360","NBC News","none","2022-03-09T02:35:44Z"
"460","rFuEXC6m1Uw","2022-03-06T17:26:39Z","UCeY0bbntWzzVIaj2z3QigXg","Full Panel: Nuclear Threat Spurs Global Anxiety","Hallie Jackson, Robin Wright, Eddie Glaude, Jr. and Stephen Hayes join the Meet the Press roundtable to discuss the Biden ...","https://i.ytimg.com/vi/rFuEXC6m1Uw/default.jpg","120","90","https://i.ytimg.com/vi/rFuEXC6m1Uw/mqdefault.jpg","320","180","https://i.ytimg.com/vi/rFuEXC6m1Uw/hqdefault.jpg","480","360","NBC News","none","2022-03-06T17:26:39Z"
"461","6eoZL6TuGAc","2022-02-19T00:51:00Z","UCeY0bbntWzzVIaj2z3QigXg","Hallie Jackson NOW - Feb. 18 | NBC News NOW","President Biden says he is convinced that Vladimir Putin has made up his mind regarding invading Ukraine, a fire broke out on a ...","https://i.ytimg.com/vi/6eoZL6TuGAc/default.jpg","120","90","https://i.ytimg.com/vi/6eoZL6TuGAc/mqdefault.jpg","320","180","https://i.ytimg.com/vi/6eoZL6TuGAc/hqdefault.jpg","480","360","NBC News","none","2022-02-19T00:51:00Z"
"462","2Dh081f2WI4","2022-02-25T01:52:00Z","UCeY0bbntWzzVIaj2z3QigXg","Hallie Jackson NOW - Feb. 24 | NBC News NOW","At least 57 people have been killed and 169 hurt following the attack on Ukraine, senior defense official tells NBC News that ...","https://i.ytimg.com/vi/2Dh081f2WI4/default.jpg","120","90","https://i.ytimg.com/vi/2Dh081f2WI4/mqdefault.jpg","320","180","https://i.ytimg.com/vi/2Dh081f2WI4/hqdefault.jpg","480","360","NBC News","none","2022-02-25T01:52:00Z"
"463","H4BT1cW-T68","2022-05-04T03:42:33Z","UCeY0bbntWzzVIaj2z3QigXg","Top Story with Tom Llamas - May 3 | NBC News NOW","Chief Justice John Roberts confirmed a leaked draft opinion regarding Roe v. Wade is authentic. Over 12 million people from ...","https://i.ytimg.com/vi/H4BT1cW-T68/default.jpg","120","90","https://i.ytimg.com/vi/H4BT1cW-T68/mqdefault.jpg","320","180","https://i.ytimg.com/vi/H4BT1cW-T68/hqdefault.jpg","480","360","NBC News","none","2022-05-04T03:42:33Z"
"464","yQUTUG9_VoM","2022-07-29T13:38:24Z","UCeY0bbntWzzVIaj2z3QigXg","This Morning’s Top Headlines – July 29 | Morning News NOW","Historic and deadly floods strike in Kentucky, the U.S. economy shrinks for the second straight quarter amid recession fears, and ...","https://i.ytimg.com/vi/yQUTUG9_VoM/default.jpg","120","90","https://i.ytimg.com/vi/yQUTUG9_VoM/mqdefault.jpg","320","180","https://i.ytimg.com/vi/yQUTUG9_VoM/hqdefault.jpg","480","360","NBC News","none","2022-07-29T13:38:24Z"
"465","4loA2jlEVys","2021-12-05T19:30:01Z","UCeY0bbntWzzVIaj2z3QigXg","Meet The Press Broadcast (Full) - Dec 5.","In exclusive interviews with Sen. Amy Klobuchar (D-Minn.) and Sen. Mike Braun (R-Ind.), Chuck discuses the future of abortion ...","https://i.ytimg.com/vi/4loA2jlEVys/default.jpg","120","90","https://i.ytimg.com/vi/4loA2jlEVys/mqdefault.jpg","320","180","https://i.ytimg.com/vi/4loA2jlEVys/hqdefault.jpg","480","360","NBC News","none","2021-12-05T19:30:01Z"
"466","16CDAxStM4U","2021-09-24T08:00:00Z","UCeY0bbntWzzVIaj2z3QigXg","Top Story with Tom Llamas - September 23 | NBC News NOW","A deadly mass shooting inside a Kroger grocery store in Tennessee kills at least one person, the Northeast faces another flooding ...","https://i.ytimg.com/vi/16CDAxStM4U/default.jpg","120","90","https://i.ytimg.com/vi/16CDAxStM4U/mqdefault.jpg","320","180","https://i.ytimg.com/vi/16CDAxStM4U/hqdefault.jpg","480","360","NBC News","none","2021-09-24T08:00:00Z"
"467","YEmCtD7J1u8","2021-11-28T19:30:03Z","UCeY0bbntWzzVIaj2z3QigXg","Meet The Press Broadcast (FULL) - Nov. 28","Subscribe to NBC News: http://nbcnews.to/SubscribeToNBC » Watch more NBC video: http://bit.ly/MoreNBCNews NBC News ...","https://i.ytimg.com/vi/YEmCtD7J1u8/default.jpg","120","90","https://i.ytimg.com/vi/YEmCtD7J1u8/mqdefault.jpg","320","180","https://i.ytimg.com/vi/YEmCtD7J1u8/hqdefault.jpg","480","360","NBC News","none","2021-11-28T19:30:03Z"
"468","Dk2m7jAuqLw","2021-08-23T14:00:04Z","UCeY0bbntWzzVIaj2z3QigXg","This Morning’s Top Headlines – August 23 | Morning News NOW","Tropical depression Henri brings heavy rain and flooding to New England, gunfire erupts at Kabul's airport as evacuation efforts ...","https://i.ytimg.com/vi/Dk2m7jAuqLw/default.jpg","120","90","https://i.ytimg.com/vi/Dk2m7jAuqLw/mqdefault.jpg","320","180","https://i.ytimg.com/vi/Dk2m7jAuqLw/hqdefault.jpg","480","360","NBC News","none","2021-08-23T14:00:04Z"
