"","video_id","publishedAt","channelId","title","description","thumbnails.default.url","thumbnails.default.width","thumbnails.default.height","thumbnails.medium.url","thumbnails.medium.width","thumbnails.medium.height","thumbnails.high.url","thumbnails.high.width","thumbnails.high.height","channelTitle","liveBroadcastContent","publishTime"
"157","d_jmZQn3CKo","2022-05-13T15:41:36Z","UCeY0bbntWzzVIaj2z3QigXg","Morning News NOW Full Broadcast - May 13","The White House marks one million Covid-19 deaths as cases rise again, Russia pulls back forces from Ukraine's second largest ...","https://i.ytimg.com/vi/d_jmZQn3CKo/default.jpg","120","90","https://i.ytimg.com/vi/d_jmZQn3CKo/mqdefault.jpg","320","180","https://i.ytimg.com/vi/d_jmZQn3CKo/hqdefault.jpg","480","360","NBC News","none","2022-05-13T15:41:36Z"
"158","XbaDqd76XKA","2022-06-28T21:30:01Z","UCeY0bbntWzzVIaj2z3QigXg","Top Takeaways From Jan. 6 ‘Surprise Witness’ Cassidy Hutchinson’s Testimony","Cassidy Hutchinson, a former aide to former Chief of Staff Mark Meadows, is the star witness of Tuesday's surprise hearing from ...","https://i.ytimg.com/vi/XbaDqd76XKA/default.jpg","120","90","https://i.ytimg.com/vi/XbaDqd76XKA/mqdefault.jpg","320","180","https://i.ytimg.com/vi/XbaDqd76XKA/hqdefault.jpg","480","360","NBC News","none","2022-06-28T21:30:01Z"
"159","-xgim6CTEVs","2022-05-31T23:41:40Z","UCeY0bbntWzzVIaj2z3QigXg","Funerals Commence For Uvalde, Texas Mass Shooting Victims","A week ago, today, A gunman killed 19 students and 2 teachers at Robb Elementary School in Uvalde, Texas leaving the ...","https://i.ytimg.com/vi/-xgim6CTEVs/default.jpg","120","90","https://i.ytimg.com/vi/-xgim6CTEVs/mqdefault.jpg","320","180","https://i.ytimg.com/vi/-xgim6CTEVs/hqdefault.jpg","480","360","NBC News","none","2022-05-31T23:41:40Z"
"160","JUud8qL1bDQ","2022-07-23T02:43:02Z","UCeY0bbntWzzVIaj2z3QigXg","Top Story with Tom Llamas - July 22 | NBC News NOW","Former Trump advisor Steve Bannon was found guilty of contempt of Congress, a sailboat carrying nearly 200 migrants was ...","https://i.ytimg.com/vi/JUud8qL1bDQ/default.jpg","120","90","https://i.ytimg.com/vi/JUud8qL1bDQ/mqdefault.jpg","320","180","https://i.ytimg.com/vi/JUud8qL1bDQ/hqdefault.jpg","480","360","NBC News","none","2022-07-23T02:43:02Z"
"161","ZyKlZcWRgtk","2022-02-27T16:30:53Z","UCeY0bbntWzzVIaj2z3QigXg","Full Panel: War In Ukraine Puts Pressure On Washington","Andrea Mitchell, Kristen Welker, Jeremy Bash and Danielle Pletka join the Meet the Press roundtable to discuss the White ...","https://i.ytimg.com/vi/ZyKlZcWRgtk/default.jpg","120","90","https://i.ytimg.com/vi/ZyKlZcWRgtk/mqdefault.jpg","320","180","https://i.ytimg.com/vi/ZyKlZcWRgtk/hqdefault.jpg","480","360","NBC News","none","2022-02-27T16:30:53Z"
"162","anmc8fU_nQY","2022-02-04T21:50:54Z","UCeY0bbntWzzVIaj2z3QigXg","Extended Interview: Nathan Chen On His Hopes For Winter Olympics","In an interview with NBC News' Lester Holt, figure skater Nathan Chen discusses his trademark quad jumps, reflects on his ...","https://i.ytimg.com/vi/anmc8fU_nQY/default.jpg","120","90","https://i.ytimg.com/vi/anmc8fU_nQY/mqdefault.jpg","320","180","https://i.ytimg.com/vi/anmc8fU_nQY/hqdefault.jpg","480","360","NBC News","none","2022-02-04T21:50:54Z"
"163","kSpypsqIQcA","2022-03-01T21:00:14Z","UCeY0bbntWzzVIaj2z3QigXg","Neutral Sweden, Switzerland Unite With Europe In Defense Against Russia","Sweden and Switzerland, countries with a long history of neutrality, are teaming up with much of Europe in uniting with Ukraine to ...","https://i.ytimg.com/vi/kSpypsqIQcA/default.jpg","120","90","https://i.ytimg.com/vi/kSpypsqIQcA/mqdefault.jpg","320","180","https://i.ytimg.com/vi/kSpypsqIQcA/hqdefault.jpg","480","360","NBC News","none","2022-03-01T21:00:14Z"
"164","x4CQBL8ZhK0","2021-06-14T00:00:19Z","UCeY0bbntWzzVIaj2z3QigXg","Record Breaking Heat Wave And Drought in Western U.S.","Record breaking heat and a lack of rainfall are threatening the western half of the U.S. The heat will not only affect Arizona this ...","https://i.ytimg.com/vi/x4CQBL8ZhK0/default.jpg","120","90","https://i.ytimg.com/vi/x4CQBL8ZhK0/mqdefault.jpg","320","180","https://i.ytimg.com/vi/x4CQBL8ZhK0/hqdefault.jpg","480","360","NBC News","none","2021-06-14T00:00:19Z"
"165","zWLPjM-b0YY","2021-01-23T19:00:22Z","UCeY0bbntWzzVIaj2z3QigXg","Cardboard Crafts: One Family Gets Creative At Home | Nightly News: Kids Edition","Dr. John Torres answers viewers' questions about the coronavirus. We take a look at the history of 'first pets' at the White House ...","https://i.ytimg.com/vi/zWLPjM-b0YY/default.jpg","120","90","https://i.ytimg.com/vi/zWLPjM-b0YY/mqdefault.jpg","320","180","https://i.ytimg.com/vi/zWLPjM-b0YY/hqdefault.jpg","480","360","NBC News","none","2021-01-23T19:00:22Z"
"166","RjZI9SUiOPI","2020-11-23T00:32:23Z","UCeY0bbntWzzVIaj2z3QigXg","Trump Lawsuit Fails To Overturn Election Results | NBC Nightly News","A Pennsylvania federal judge threw out a Trump Campaign lawsuit, comparing it to “Frankenstein's Monster.” Meanwhile, Joe ...","https://i.ytimg.com/vi/RjZI9SUiOPI/default.jpg","120","90","https://i.ytimg.com/vi/RjZI9SUiOPI/mqdefault.jpg","320","180","https://i.ytimg.com/vi/RjZI9SUiOPI/hqdefault.jpg","480","360","NBC News","none","2020-11-23T00:32:23Z"
"167","7StTddKgruA","2022-04-22T17:00:04Z","UCeY0bbntWzzVIaj2z3QigXg","Marjorie Taylor Greene Testifies In Court Over Challenge To Re-Election Bid","Rep. Marjorie Taylor Greene, R-Ga., testified in a state court for a lawsuit alleging she should not be allowed to run for re-election ...","https://i.ytimg.com/vi/7StTddKgruA/default.jpg","120","90","https://i.ytimg.com/vi/7StTddKgruA/mqdefault.jpg","320","180","https://i.ytimg.com/vi/7StTddKgruA/hqdefault.jpg","480","360","NBC News","none","2022-04-22T17:00:04Z"
"168","jSC5qSKmc8Q","2022-01-20T19:08:09Z","UCeY0bbntWzzVIaj2z3QigXg","Tesla Driver Is First Person To Be Charged In A Fatal Crash Involving Autopilot","A Tesla driver was charged with vehicular manslaughter after he said his car was on Autopilot when it crashed into another ...","https://i.ytimg.com/vi/jSC5qSKmc8Q/default.jpg","120","90","https://i.ytimg.com/vi/jSC5qSKmc8Q/mqdefault.jpg","320","180","https://i.ytimg.com/vi/jSC5qSKmc8Q/hqdefault.jpg","480","360","NBC News","none","2022-01-20T19:08:09Z"
"169","yhYlZnQpu-w","2022-07-08T11:51:52Z","UCeY0bbntWzzVIaj2z3QigXg","Former Japanese Prime Minister Shinzo Abe Assassinated At Campaign Event","Former Japanese Prime Minister Shinzo Abe has died after being shot during a campaign event in the western city of Nara, Japan ...","https://i.ytimg.com/vi/yhYlZnQpu-w/default.jpg","120","90","https://i.ytimg.com/vi/yhYlZnQpu-w/mqdefault.jpg","320","180","https://i.ytimg.com/vi/yhYlZnQpu-w/hqdefault.jpg","480","360","NBC News","none","2022-07-08T11:51:52Z"
"170","DU-CG2NKv9Q","2021-10-05T20:17:29Z","UCeY0bbntWzzVIaj2z3QigXg","How The West Was Lost: Climate Change | Meet The Press Reports","The Mountain West may soon be beyond our natural resources and may become uninhabitable. » Subscribe to NBC News: ...","https://i.ytimg.com/vi/DU-CG2NKv9Q/default.jpg","120","90","https://i.ytimg.com/vi/DU-CG2NKv9Q/mqdefault.jpg","320","180","https://i.ytimg.com/vi/DU-CG2NKv9Q/hqdefault.jpg","480","360","NBC News","none","2021-10-05T20:17:29Z"
"171","GEFDTHqjb8k","2022-02-10T05:00:05Z","UCeY0bbntWzzVIaj2z3QigXg","Putin Stations Thousands Of Russian Troops In Belarus As Fears Of Ukraine Invasion Rise","Russian President Vladimir Putin has stationed tens of thousands of troops near Ukraine's borders in Belarus for military exercises ...","https://i.ytimg.com/vi/GEFDTHqjb8k/default.jpg","120","90","https://i.ytimg.com/vi/GEFDTHqjb8k/mqdefault.jpg","320","180","https://i.ytimg.com/vi/GEFDTHqjb8k/hqdefault.jpg","480","360","NBC News","none","2022-02-10T05:00:05Z"
"172","DO7aVBFHp7o","2021-12-21T08:30:02Z","UCeY0bbntWzzVIaj2z3QigXg","Philippines Struggling After Deadly Typhoon","The Philippines are reeling from the devastation of the category five Super Typhoon Rye. NBC News Vaughn Hillyard explains.","https://i.ytimg.com/vi/DO7aVBFHp7o/default.jpg","120","90","https://i.ytimg.com/vi/DO7aVBFHp7o/mqdefault.jpg","320","180","https://i.ytimg.com/vi/DO7aVBFHp7o/hqdefault.jpg","480","360","NBC News","none","2021-12-21T08:30:02Z"
"173","cACWOvKMTVY","2022-07-30T03:56:53Z","UCeY0bbntWzzVIaj2z3QigXg","Top Story with Tom Llamas - July 29 | NBC News NOW","Dangerous flash flooding in Eastern Kentucky and Las Vegas, Haiti's deadly gang violence spikes and NBC News' Pete Williams ...","https://i.ytimg.com/vi/cACWOvKMTVY/default.jpg","120","90","https://i.ytimg.com/vi/cACWOvKMTVY/mqdefault.jpg","320","180","https://i.ytimg.com/vi/cACWOvKMTVY/hqdefault.jpg","480","360","NBC News","none","2022-07-30T03:56:53Z"
"174","lyE14cfmIE4","2022-06-08T02:29:17Z","UCeY0bbntWzzVIaj2z3QigXg","Top Story with Tom Llamas - June 7 | NBC News NOW","Matthew McConaughey gives a passionate plea for gun legislation at the White House, gas prices surge past $5 in 13 states, and ...","https://i.ytimg.com/vi/lyE14cfmIE4/default.jpg","120","90","https://i.ytimg.com/vi/lyE14cfmIE4/mqdefault.jpg","320","180","https://i.ytimg.com/vi/lyE14cfmIE4/hqdefault.jpg","480","360","NBC News","none","2022-06-08T02:29:17Z"
"175","FCo-9pCSsts","2022-08-06T02:30:08Z","UCeY0bbntWzzVIaj2z3QigXg","Top Story with Tom Llamas - Aug. 5 | NBC News NOW","Conspiracy theorist Alex Jones is set to pay $45.2 million in punitive damages to Sandy Hook parents, Dick Cheney slams Donald ...","https://i.ytimg.com/vi/FCo-9pCSsts/default.jpg","120","90","https://i.ytimg.com/vi/FCo-9pCSsts/mqdefault.jpg","320","180","https://i.ytimg.com/vi/FCo-9pCSsts/hqdefault.jpg","480","360","NBC News","none","2022-08-06T02:30:08Z"
"176","hqk6lSm4v8g","2021-05-03T23:21:16Z","UCeY0bbntWzzVIaj2z3QigXg","Bill And Melinda Gates Announce Divorce | NBC Nightly News","Bill and Melinda Gates announced their divorce in identical statements on social media, and said they will continue their work at ...","https://i.ytimg.com/vi/hqk6lSm4v8g/default.jpg","120","90","https://i.ytimg.com/vi/hqk6lSm4v8g/mqdefault.jpg","320","180","https://i.ytimg.com/vi/hqk6lSm4v8g/hqdefault.jpg","480","360","NBC News","none","2021-05-03T23:21:16Z"
"177","keGDAL8Hb78","2022-05-20T01:06:50Z","UCeY0bbntWzzVIaj2z3QigXg","Turkey Opposes Sweden And Finland’s Bid To Join","Sweden and Finland are aiming to become the newest members of NATO to deter a Russian invasion. All NATO members must ...","https://i.ytimg.com/vi/keGDAL8Hb78/default.jpg","120","90","https://i.ytimg.com/vi/keGDAL8Hb78/mqdefault.jpg","320","180","https://i.ytimg.com/vi/keGDAL8Hb78/hqdefault.jpg","480","360","NBC News","none","2022-05-20T01:06:50Z"
"178","Iwbxdt1Qd5I","2022-03-24T23:44:44Z","UCeY0bbntWzzVIaj2z3QigXg","Biden Says U.S. Will Respond If Russia Uses Chemical Weapons","President Biden declared the U.S. will take action if Russia uses chemical weapons in Ukraine, but did not get specific about ...","https://i.ytimg.com/vi/Iwbxdt1Qd5I/default.jpg","120","90","https://i.ytimg.com/vi/Iwbxdt1Qd5I/mqdefault.jpg","320","180","https://i.ytimg.com/vi/Iwbxdt1Qd5I/hqdefault.jpg","480","360","NBC News","none","2022-03-24T23:44:44Z"
"179","JNfdYfr8QUc","2022-05-21T01:15:55Z","UCeY0bbntWzzVIaj2z3QigXg","Top Story with Tom Llamas - May 20 | NBC News NOW","A judge blocks the Biden administration's plan to lift Title 42, New York City officials investigate a possible monkeypox case and ...","https://i.ytimg.com/vi/JNfdYfr8QUc/default.jpg","120","90","https://i.ytimg.com/vi/JNfdYfr8QUc/mqdefault.jpg","320","180","https://i.ytimg.com/vi/JNfdYfr8QUc/hqdefault.jpg","480","360","NBC News","none","2022-05-21T01:15:55Z"
"180","kIlGP2e-r7U","2022-01-04T14:30:17Z","UCeY0bbntWzzVIaj2z3QigXg","Elizabeth Holmes Faces Up To 20 Years In Prison After Being Found Guilty","Theranos founder Elizabeth Holmes was found guilty on four our of 11 federal fraud charges for exaggerating her company's ...","https://i.ytimg.com/vi/kIlGP2e-r7U/default.jpg","120","90","https://i.ytimg.com/vi/kIlGP2e-r7U/mqdefault.jpg","320","180","https://i.ytimg.com/vi/kIlGP2e-r7U/hqdefault.jpg","480","360","NBC News","none","2022-01-04T14:30:17Z"
"181","K3fWngNY2ZM","2021-10-06T02:40:51Z","UCeY0bbntWzzVIaj2z3QigXg","Top Story with Tom Llamas Full Broadcast - October 5th | NBC News NOW","Facebook whistleblower demands Congress takes action against the tech giants' business practices, California in state of ...","https://i.ytimg.com/vi/K3fWngNY2ZM/default.jpg","120","90","https://i.ytimg.com/vi/K3fWngNY2ZM/mqdefault.jpg","320","180","https://i.ytimg.com/vi/K3fWngNY2ZM/hqdefault.jpg","480","360","NBC News","none","2021-10-06T02:40:51Z"
"182","WTGnd6TNLB0","2023-10-20T20:18:09Z","UCeY0bbntWzzVIaj2z3QigXg","Full special report: U.S. hostages released by Hamas identified","The Israeli government has confirmed the identities of the two American hostages released by Hamas as Judith and Natalie ...","https://i.ytimg.com/vi/WTGnd6TNLB0/default.jpg","120","90","https://i.ytimg.com/vi/WTGnd6TNLB0/mqdefault.jpg","320","180","https://i.ytimg.com/vi/WTGnd6TNLB0/hqdefault.jpg","480","360","NBC News","none","2023-10-20T20:18:09Z"
"183","mssEIY_WEj8","2021-10-16T03:00:16Z","UCeY0bbntWzzVIaj2z3QigXg","Nightly News Full Broadcast - October 15th","FDA panel recommends Johnson & Johnson booster shot, Covid vaccine mandates fueling showdowns nationwide, and former ...","https://i.ytimg.com/vi/mssEIY_WEj8/default.jpg","120","90","https://i.ytimg.com/vi/mssEIY_WEj8/mqdefault.jpg","320","180","https://i.ytimg.com/vi/mssEIY_WEj8/hqdefault.jpg","480","360","NBC News","none","2021-10-16T03:00:16Z"
"184","Klt4jNCsmBM","2021-10-17T17:45:00Z","UCeY0bbntWzzVIaj2z3QigXg","Evangelicals: &#39;The Bible Belt Is Unbuckling&#39;","Meet the Press Reports: Evangelical voters are reconsidering their political activism after Trump, with some activists taking a ...","https://i.ytimg.com/vi/Klt4jNCsmBM/default.jpg","120","90","https://i.ytimg.com/vi/Klt4jNCsmBM/mqdefault.jpg","320","180","https://i.ytimg.com/vi/Klt4jNCsmBM/hqdefault.jpg","480","360","NBC News","none","2021-10-17T17:45:00Z"
"185","h0paiFBB7E8","2022-01-13T01:09:09Z","UCeY0bbntWzzVIaj2z3QigXg","What’s Behind Empty Shelves At Stores Across The U.S.","NBC News' Tom Costello looks into some of the reasons why many store shelves are empty. Some key factors at play: soaring ...","https://i.ytimg.com/vi/h0paiFBB7E8/default.jpg","120","90","https://i.ytimg.com/vi/h0paiFBB7E8/mqdefault.jpg","320","180","https://i.ytimg.com/vi/h0paiFBB7E8/hqdefault.jpg","480","360","NBC News","none","2022-01-13T01:09:09Z"
"186","7l6XVCf5rOo","2021-12-05T04:06:09Z","UCeY0bbntWzzVIaj2z3QigXg","Nightly News Full Broadcast - Dec. 4","Parents of Michigan school shooting suspect arraigned in court, unprecedented charges in Michigan high school shooting, and ...","https://i.ytimg.com/vi/7l6XVCf5rOo/default.jpg","120","90","https://i.ytimg.com/vi/7l6XVCf5rOo/mqdefault.jpg","320","180","https://i.ytimg.com/vi/7l6XVCf5rOo/hqdefault.jpg","480","360","NBC News","none","2021-12-05T04:06:09Z"
"187","krtlDMLnV6A","2022-06-30T02:44:42Z","UCeY0bbntWzzVIaj2z3QigXg","Top Story with Tom Llamas - June 29 | NBC News NOW","Airlines warn of July 4th flight disruptions across the U.S., NATO expands amid renewed Russian attacks, and a bison attacked a ...","https://i.ytimg.com/vi/krtlDMLnV6A/default.jpg","120","90","https://i.ytimg.com/vi/krtlDMLnV6A/mqdefault.jpg","320","180","https://i.ytimg.com/vi/krtlDMLnV6A/hqdefault.jpg","480","360","NBC News","none","2022-06-30T02:44:42Z"
"188","etKuKD3UaMs","2023-10-21T23:00:16Z","UCeY0bbntWzzVIaj2z3QigXg","‘We are in hell!’: Families of Hamas hostages demand more action","Friends and families of Hamas hostages protested in central Tel Aviv, demanding greater efforts from their government and the ...","https://i.ytimg.com/vi/etKuKD3UaMs/default.jpg","120","90","https://i.ytimg.com/vi/etKuKD3UaMs/mqdefault.jpg","320","180","https://i.ytimg.com/vi/etKuKD3UaMs/hqdefault.jpg","480","360","NBC News","none","2023-10-21T23:00:16Z"
"189","vu9DuoZxLro","2022-06-17T15:37:16Z","UCeY0bbntWzzVIaj2z3QigXg","Morning News NOW Full Broadcast - June 17","The House Jan. 6 committee presented new information on how former Vice President Mike Pence resisted pressure to block the ...","https://i.ytimg.com/vi/vu9DuoZxLro/default.jpg","120","90","https://i.ytimg.com/vi/vu9DuoZxLro/mqdefault.jpg","320","180","https://i.ytimg.com/vi/vu9DuoZxLro/hqdefault.jpg","480","360","NBC News","none","2022-06-17T15:37:16Z"
"190","hDaBljvB1yQ","2023-10-20T12:30:32Z","UCeY0bbntWzzVIaj2z3QigXg","Video shows aftermath of a deadly blast at an Orthodox church in Gaza City","A Greek Orthodox church in the Gaza Strip that was sheltering hundreds of displaced Palestinians was hit by a deadly explosion ...","https://i.ytimg.com/vi/hDaBljvB1yQ/default.jpg","120","90","https://i.ytimg.com/vi/hDaBljvB1yQ/mqdefault.jpg","320","180","https://i.ytimg.com/vi/hDaBljvB1yQ/hqdefault.jpg","480","360","NBC News","none","2023-10-20T12:30:32Z"
"191","N8_S8fbtGg0","2022-05-12T15:45:01Z","UCeY0bbntWzzVIaj2z3QigXg","Morning News NOW Full Broadcast - May 12","Gas prices soar as inflation hits record levels, Senate Democrats' bill to keep abortions legal nationwide fails, and a coastal ...","https://i.ytimg.com/vi/N8_S8fbtGg0/default.jpg","120","90","https://i.ytimg.com/vi/N8_S8fbtGg0/mqdefault.jpg","320","180","https://i.ytimg.com/vi/N8_S8fbtGg0/hqdefault.jpg","480","360","NBC News","none","2022-05-12T15:45:01Z"
"192","fbzNP6BY3x4","2020-10-24T00:00:13Z","UCeY0bbntWzzVIaj2z3QigXg","Suspect Accused Of Plotting To Assassinate Joe Biden | NBC Nightly News","Officials allege a man from Washington state took steps toward plotting to kill Joe Biden this spring, but may have been intent on ...","https://i.ytimg.com/vi/fbzNP6BY3x4/default.jpg","120","90","https://i.ytimg.com/vi/fbzNP6BY3x4/mqdefault.jpg","320","180","https://i.ytimg.com/vi/fbzNP6BY3x4/hqdefault.jpg","480","360","NBC News","none","2020-10-24T00:00:13Z"
"193","QLYwG4xvAkQ","2022-04-01T03:33:56Z","UCeY0bbntWzzVIaj2z3QigXg","Top Story with Tom Llamas - March 31 | NBC News NOW","Russian troops abandoned their posts at Chernobyl after being exposed to “significant doses” of radiation, nearly 30 tornadoes ...","https://i.ytimg.com/vi/QLYwG4xvAkQ/default.jpg","120","90","https://i.ytimg.com/vi/QLYwG4xvAkQ/mqdefault.jpg","320","180","https://i.ytimg.com/vi/QLYwG4xvAkQ/hqdefault.jpg","480","360","NBC News","none","2022-04-01T03:33:56Z"
"194","eAcq6pCjJJs","2022-03-08T18:00:25Z","UCeY0bbntWzzVIaj2z3QigXg","Plan To Send Ukraine Soviet-Era Fighter Jets Stalls","A proposed plan to send Soviet-era fighter jets to Ukraine has stalled after officials in the Biden administration said it may not be ...","https://i.ytimg.com/vi/eAcq6pCjJJs/default.jpg","120","90","https://i.ytimg.com/vi/eAcq6pCjJJs/mqdefault.jpg","320","180","https://i.ytimg.com/vi/eAcq6pCjJJs/hqdefault.jpg","480","360","NBC News","none","2022-03-08T18:00:25Z"
"195","pHaqFoisZBc","2022-06-29T23:42:58Z","UCeY0bbntWzzVIaj2z3QigXg","Hallie Jackson NOW - June 29 | NBC News NOW","R. Kelly was sentenced to 30 years in prison in a sex trafficking case, President Biden announces an increase in U.S. military ...","https://i.ytimg.com/vi/pHaqFoisZBc/default.jpg","120","90","https://i.ytimg.com/vi/pHaqFoisZBc/mqdefault.jpg","320","180","https://i.ytimg.com/vi/pHaqFoisZBc/hqdefault.jpg","480","360","NBC News","none","2022-06-29T23:42:58Z"
"196","H6xVLZYSVfc","2023-10-20T19:30:01Z","UCeY0bbntWzzVIaj2z3QigXg","Full special report: Sources report two American hostages released by Hamas","Three sources with direct knowledge of the matter tell NBC News that Hamas has released two American hostages who were ...","https://i.ytimg.com/vi/H6xVLZYSVfc/default.jpg","120","90","https://i.ytimg.com/vi/H6xVLZYSVfc/mqdefault.jpg","320","180","https://i.ytimg.com/vi/H6xVLZYSVfc/hqdefault.jpg","480","360","NBC News","none","2023-10-20T19:30:01Z"
"197","w-vxW7rKLec","2022-01-30T01:14:22Z","UCeY0bbntWzzVIaj2z3QigXg","Ukraine Braces For Possible Invasion As Russia Adds Military Force","The Pentagon says Russia has enough troops around Ukraine to invade the entire country. New propaganda video from Russia ...","https://i.ytimg.com/vi/w-vxW7rKLec/default.jpg","120","90","https://i.ytimg.com/vi/w-vxW7rKLec/mqdefault.jpg","320","180","https://i.ytimg.com/vi/w-vxW7rKLec/hqdefault.jpg","480","360","NBC News","none","2022-01-30T01:14:22Z"
"198","ouvdyoIDbh0","2021-12-22T00:38:58Z","UCeY0bbntWzzVIaj2z3QigXg","Putin Makes New Threats As Russia-Ukraine Tensions Grow","Russian President Vladimir Putin is demanding that NATO withdraw its troops from Eastern Europe, with more than 100000 troops ...","https://i.ytimg.com/vi/ouvdyoIDbh0/default.jpg","120","90","https://i.ytimg.com/vi/ouvdyoIDbh0/mqdefault.jpg","320","180","https://i.ytimg.com/vi/ouvdyoIDbh0/hqdefault.jpg","480","360","NBC News","none","2021-12-22T00:38:58Z"
"199","sNdfbgnzD4Y","2022-05-20T15:17:43Z","UCeY0bbntWzzVIaj2z3QigXg","Morning News NOW Full Broadcast - May 20","The White House works to speed up baby formula production amid a shortage, concern intensifies over a possible recession as ...","https://i.ytimg.com/vi/sNdfbgnzD4Y/default.jpg","120","90","https://i.ytimg.com/vi/sNdfbgnzD4Y/mqdefault.jpg","320","180","https://i.ytimg.com/vi/sNdfbgnzD4Y/hqdefault.jpg","480","360","NBC News","none","2022-05-20T15:17:43Z"
"200","IxameETwHgo","2021-12-27T22:00:09Z","UCeY0bbntWzzVIaj2z3QigXg","Goodbye 2021: A Year To Remember… And Forget!","NBC News Now's Savannah Sellers and Joe Fryer look back at the milestones defining 2021, and the lessons ahead for 2022 ...","https://i.ytimg.com/vi/IxameETwHgo/default.jpg","120","90","https://i.ytimg.com/vi/IxameETwHgo/mqdefault.jpg","320","180","https://i.ytimg.com/vi/IxameETwHgo/hqdefault.jpg","480","360","NBC News","none","2021-12-27T22:00:09Z"
"201","IxameETwHgo","2021-12-27T22:00:09Z","UCeY0bbntWzzVIaj2z3QigXg","Goodbye 2021: A Year To Remember… And Forget!","NBC News Now's Savannah Sellers and Joe Fryer look back at the milestones defining 2021, and the lessons ahead for 2022 ...","https://i.ytimg.com/vi/IxameETwHgo/default.jpg","120","90","https://i.ytimg.com/vi/IxameETwHgo/mqdefault.jpg","320","180","https://i.ytimg.com/vi/IxameETwHgo/hqdefault.jpg","480","360","NBC News","none","2021-12-27T22:00:09Z"
"202","vKx82FMZ_LU","2020-04-23T23:54:39Z","UCeY0bbntWzzVIaj2z3QigXg","Empty Las Vegas Casinos At Center Of Clash Over Reopening | NBC Nightly News","Casinos in Las Vegas have sat empty for weeks because of the coronavirus pandemic, representing millions in lost revenue.","https://i.ytimg.com/vi/vKx82FMZ_LU/default.jpg","120","90","https://i.ytimg.com/vi/vKx82FMZ_LU/mqdefault.jpg","320","180","https://i.ytimg.com/vi/vKx82FMZ_LU/hqdefault.jpg","480","360","NBC News","none","2020-04-23T23:54:39Z"
"203","rsGwS2fNbTU","2022-02-26T00:48:49Z","UCeY0bbntWzzVIaj2z3QigXg","Ukraine’s Capital Under Attack as Russian Forces Advance","Kyiv residents were told to shelter in place as Russian troops arrived. Some are scrambling to find safety, or sheltering in a metro ...","https://i.ytimg.com/vi/rsGwS2fNbTU/default.jpg","120","90","https://i.ytimg.com/vi/rsGwS2fNbTU/mqdefault.jpg","320","180","https://i.ytimg.com/vi/rsGwS2fNbTU/hqdefault.jpg","480","360","NBC News","none","2022-02-26T00:48:49Z"
"204","sNdfbgnzD4Y","2022-05-20T15:17:43Z","UCeY0bbntWzzVIaj2z3QigXg","Morning News NOW Full Broadcast - May 20","The White House works to speed up baby formula production amid a shortage, concern intensifies over a possible recession as ...","https://i.ytimg.com/vi/sNdfbgnzD4Y/default.jpg","120","90","https://i.ytimg.com/vi/sNdfbgnzD4Y/mqdefault.jpg","320","180","https://i.ytimg.com/vi/sNdfbgnzD4Y/hqdefault.jpg","480","360","NBC News","none","2022-05-20T15:17:43Z"
"205","d-MDsKmSwWg","2022-06-09T00:45:55Z","UCeY0bbntWzzVIaj2z3QigXg","Hallie Jackson NOW - June 8 | NBC News NOW","The families of victims from mass shootings testified before Congress, the Department of Justice will review law enforcement's ...","https://i.ytimg.com/vi/d-MDsKmSwWg/default.jpg","120","90","https://i.ytimg.com/vi/d-MDsKmSwWg/mqdefault.jpg","320","180","https://i.ytimg.com/vi/d-MDsKmSwWg/hqdefault.jpg","480","360","NBC News","none","2022-06-09T00:45:55Z"
"206","QSqqd3CYcaw","2021-10-10T23:39:18Z","UCeY0bbntWzzVIaj2z3QigXg","Southwest Airlines Cancels Thousands of Flights","Southwest Airlines has cancelled at least 1800 flights this weekend, 27 percent of the fleet was grounded on Sunday. They're ...","https://i.ytimg.com/vi/QSqqd3CYcaw/default.jpg","120","90","https://i.ytimg.com/vi/QSqqd3CYcaw/mqdefault.jpg","320","180","https://i.ytimg.com/vi/QSqqd3CYcaw/hqdefault.jpg","480","360","NBC News","none","2021-10-10T23:39:18Z"
"207","mIf5Z-iBjy8","2022-06-18T00:14:30Z","UCeY0bbntWzzVIaj2z3QigXg","Gunman Opens Fire In Alabama Episcopal Church Leaving Three Dead","Three people were killed in a shooting at St. Stephens Episcopal Church in Vestavia Hills, Alabama. The congregation was ...","https://i.ytimg.com/vi/mIf5Z-iBjy8/default.jpg","120","90","https://i.ytimg.com/vi/mIf5Z-iBjy8/mqdefault.jpg","320","180","https://i.ytimg.com/vi/mIf5Z-iBjy8/hqdefault.jpg","480","360","NBC News","none","2022-06-18T00:14:30Z"
"208","AqZZJCSX77E","2022-01-04T04:30:01Z","UCeY0bbntWzzVIaj2z3QigXg","Top Story with Tom Llamas - Jan. 3 | NBC News NOW","Several school districts are starting the new year remote and people wait in lines for hours for tests and Covid-19 cases spread ...","https://i.ytimg.com/vi/AqZZJCSX77E/default.jpg","120","90","https://i.ytimg.com/vi/AqZZJCSX77E/mqdefault.jpg","320","180","https://i.ytimg.com/vi/AqZZJCSX77E/hqdefault.jpg","480","360","NBC News","none","2022-01-04T04:30:01Z"
